{
  "schema_version": 1,
  "program_id": "fish_inverse_control_v1",
  "objective": "Progress from trustworthy neural activation measurements to causal pre-movement left/right decoding, action-conditioned system identification, and uncertainty-gated inverse control.",
  "hardware_profile": {
    "captured_at": "2026-07-21T15:15:00Z",
    "cpu_model": "Intel Core i9-14900K",
    "cpu_logical_count": 32,
    "ram_total_gib": 78,
    "gpu_name": "NVIDIA GeForce RTX 4070 SUPER",
    "gpu_memory_mib": 12282,
    "gpu_memory_reserve_mib": 2200,
    "recommended_max_cpu_threads": 16,
    "recommended_max_ram_gib": 48,
    "min_free_disk_gib": 200,
    "max_concurrent_gpu_jobs": 1
  },
  "gates": [
    {
      "id": "activation_precision",
      "label": "Activation precision is measurable and robust",
      "status": "insufficient_evidence",
      "evidence": [
        "Learnable-direct v3 tied frozen raw-direct at 0.6056 mean sparse-positive held-out recall.",
        "Existing labels contain 79 burst rows across 27 unique ROIs."
      ],
      "blockers": [
        "No exhaustively reviewed spatial-temporal evaluation panel exists, so ordinary precision is not identifiable."
      ],
      "pass_criteria": [
        "Exhaustive held-out tiles support object and event PR/FROC metrics.",
        "The selected detector meets pre-registered recall and false-positive targets across fish/session and artifact strata."
      ]
    },
    {
      "id": "intent_data",
      "label": "Causal pre-movement intent data are ready",
      "status": "insufficient_evidence",
      "evidence": [
        "The existing 11-video latent smoke test is video-level and weakly separable.",
        "Behavior-alignment utilities exist."
      ],
      "blockers": [
        "Frame-synchronized movement onset, direction, uncertainty, and leakage-guarded trial windows are not yet available as a frozen dataset."
      ],
      "pass_criteria": [
        "Aligned trial manifest passes fish/session, class-balance, missingness, and timing-uncertainty checks.",
        "Every neural feature window ends before the movement-onset uncertainty guard."
      ]
    },
    {
      "id": "intent_signal",
      "label": "Left/right intent generalizes",
      "status": "not_started",
      "evidence": [
        "The current ridge latent head reached 0.3636 accuracy, equal to the majority baseline."
      ],
      "blockers": [
        "Intent data gate has not passed."
      ],
      "pass_criteria": [
        "A pre-registered model improves held-out balanced accuracy, macro F1, and calibration over behavior-only and population-only baselines.",
        "Spatial and temporal leakage controls pass on held-out fish or sessions."
      ]
    },
    {
      "id": "action_data",
      "label": "Stimulation actions are identifiable",
      "status": "blocked",
      "evidence": [
        "Inverse-dynamics export and timestamp-alignment utilities exist."
      ],
      "blockers": [
        "Requested and measured stimulation actions, timing, target, amplitude, duration, sham status, and safety interventions are not populated."
      ],
      "pass_criteria": [
        "Safe counterbalanced action coverage and no-action/sham controls exist.",
        "Requested-versus-measured action and latency residuals meet the acquisition contract."
      ]
    },
    {
      "id": "system_id",
      "label": "Action-conditioned transitions are calibrated",
      "status": "not_started",
      "evidence": [],
      "blockers": [
        "Action-data gate has not passed."
      ],
      "pass_criteria": [
        "Action-conditioned models beat action-free models on held-out sessions and supported stimulation levels.",
        "Target and off-target outcomes are calibrated and uncertainty rises outside training support."
      ]
    },
    {
      "id": "simulator_control",
      "label": "Constrained control works in simulation",
      "status": "not_started",
      "evidence": [],
      "blockers": [
        "System-identification gate has not passed."
      ],
      "pass_criteria": [
        "Uncertainty-gated MPC beats no-action, fixed-safe, and randomized-safe policies.",
        "All simulated actions remain inside the approved envelope and unsupported trajectories abstain."
      ]
    },
    {
      "id": "deployment",
      "label": "Shadow and closed-loop deployment are safe",
      "status": "not_started",
      "evidence": [
        "Latency p50/p95/p99 instrumentation exists in the repository."
      ],
      "blockers": [
        "No simulator pass, shadow-mode evidence, approved action envelope, or command interlock exists."
      ],
      "pass_criteria": [
        "Shadow-mode latency, drift, abstention, and watchdog tests pass.",
        "Explicit safety and experimental approvals are recorded before command-capable execution."
      ]
    }
  ],
  "experiments": [
    {
      "id": "fc00_activation_annotation_panel_v1",
      "title": "Exhaustive activation annotation panel",
      "stage": "measurement",
      "status": "planned",
      "priority": 1,
      "hypothesis": "A stratified exhaustive panel will reveal that current false-positive burden is concentrated in motion, bright-background, overlap, and detector-disagreement strata.",
      "decision": "Determine whether detector precision is measurable and which error strata dominate the next model comparison.",
      "impact": 5,
      "information_gain": 5,
      "cost": 2,
      "risk": 1,
      "launch_policy": "manual_action",
      "dependencies": [],
      "requires_gate": null,
      "advances_gate": "activation_precision",
      "resources": {
        "device": "none",
        "cpu_threads": 1,
        "max_ram_gib": 2,
        "max_wall_hours": 0
      },
      "inputs": [
        {
          "role": "source_video_cache",
          "path": "../Outputs/GammaCFAR/spon_ca_burst_3_hindbrain_to_tail_488_20ms/spon_ca_burst_3_hindbrain_to_tail_488_20ms.npy",
          "required_for_launch": true
        },
        {
          "role": "sparse_positive_labels",
          "path": "../Inputs/Spon Ca Burst/labels/labels_normalized.tsv",
          "required_for_launch": true
        }
      ],
      "output_root": "../Outputs/FishControl/activation_annotation_panel_v1",
      "resume_policy": "refuse_existing",
      "success_criteria": [
        "At least 120 stratified spatial-temporal tiles receive explicit exhaustive, candidate-review, or sparse-positive coverage labels.",
        "A dual-reviewed subset reports agreement and adjudication.",
        "Every unmatched candidate has a valid known-negative or unknown interpretation."
      ],
      "stop_conditions": [
        "Stop if coordinate/frame overlays reveal a convention mismatch.",
        "Stop if fewer than three independent sessions or videos can be represented."
      ]
    },
    {
      "id": "fc01_frozen_detector_tournament_v1",
      "title": "Frozen detector and structured-background tournament",
      "stage": "measurement",
      "status": "planned",
      "priority": 2,
      "hypothesis": "Preserving absolute amplitude while modeling spatially structured background and trace kinetics will improve recall at fixed false-positive burden over pure learned contrast.",
      "decision": "Select the measurement pipeline that supplies intent features; decide whether a learnable refinement is warranted.",
      "impact": 5,
      "information_gain": 5,
      "cost": 2,
      "risk": 1,
      "launch_policy": "safe_cpu",
      "dependencies": [
        "fc00_activation_annotation_panel_v1"
      ],
      "requires_gate": null,
      "advances_gate": "activation_precision",
      "resources": {
        "device": "cpu",
        "cpu_threads": 16,
        "max_ram_gib": 32,
        "max_wall_hours": 6
      },
      "inputs": [
        {
          "role": "exhaustive_benchmark_manifest",
          "path": "../Outputs/FishControl/activation_annotation_panel_v1/benchmark_manifest.json",
          "required_for_launch": true
        }
      ],
      "output_root": "../Outputs/FishControl/frozen_detector_tournament_v1",
      "resume_policy": "refuse_existing",
      "design": {
        "factor_grid": {
          "method": [
            "raw_direct",
            "gamma_cfar",
            "learned_contrast_v2",
            "direct_tuned_v3",
            "caiman_cnmf",
            "annular_background_plus_deconvolution"
          ]
        },
        "repeats": 1,
        "expected_jobs": 6,
        "split_unit": "held-out fish if available, otherwise session/video",
        "primary_metrics": [
          "object_average_precision",
          "event_average_precision",
          "recall_at_fixed_false_positives_per_megapixel_minute",
          "event_timing_error_ms",
          "calibration_error"
        ],
        "controls": [
          "quiet tiles",
          "motion-corrupted tiles",
          "bright-background tiles",
          "overlapping-neuron tiles",
          "detector-disagreement tiles"
        ]
      },
      "success_criteria": [
        "A frozen operating point improves both event precision and recall over raw-direct with group-bootstrap uncertainty excluding zero.",
        "Attribution, duplicate, split, and merge errors are reported separately."
      ],
      "stop_conditions": [
        "Do not tune on the sealed test panel.",
        "Stop model expansion if no method beats raw-direct across at least two independent groups."
      ]
    },
    {
      "id": "fc02_structured_background_pu_v1",
      "title": "Structured-background and PU refinement",
      "stage": "measurement",
      "status": "planned",
      "priority": 3,
      "hypothesis": "A soma-excluding annular background model plus non-negative positive-unlabeled risk will reduce false detections without sacrificing the raw-direct recall advantage.",